evidence_id,device,date,file_name,sha256,category,observation,interpretation,strength,privacy_status,public_sample_path,notes
EVID-001,mini1,2026-03-12,Analytics-2026-03-12-070038.ips,a6d312d5553b68e1923c9470de6729277bdd385b3393ffe8af6d9750380a5b09,proximity_communication,"SIMTransfer; BluetoothDiscovery; CommCenter; BasebandPowerCycle; PrivacyProxy; RSSI; Nearby; resource reactions","mini1 proximity/communication peak","very_high","summary_only","not_published","Raw log is not publicly uploaded."
EVID-002,15G,2026-03-07,sysdiagnose_2026.03.07_18-46-52+0700_iPhone-OS_iPhone_22F76.tar.gz,,bssid_location_anchor,"WiFiConnectionQuality/sysdiagnose showed SSID/BSSID/RSSI/channel/lastJoined timestamp","Physical Wi-Fi location anchor, not person/device attribution","high","summary_only","not_published","SSID and BSSID values are not published. Raw sysdiagnose is withheld."
EVID-003,Manifest,multiple,Manifest.db,,manifest_db_anomaly,"Manifest.db repeatedly behaved as non-SQLite / opaque / high-entropy structure","Backup path / backup service anomaly candidate","high","summary_only","reports/01_manifest_db_anomaly.md","Core issue is not merely encrypted backup handling. Raw Manifest.db is not published."
EVID-004,multi_device,2025-07_to_2026-03,StructureShift_FULL_and_NORMALIZED_results,,phase_shift,"Normalized analysis showed March 2026 density increase in restriction-layer, ID/cloud, resource-pressure and operational-trace categories","Alpha-to-beta phase transition candidate","high","summary_only","reports/04_march2026_beta_phase.md","Uses normalized per-file/per-day comparison."
EVID-005,multi_device,2026-03-07_to_2026-03-21,March2026_RAWONLY_DEDUP_results,,march2026_focus,"RAWONLY + DEDUP analysis preserved March 7, March 12, March 14, March 15, March 21 reaction structure","March 2026 focused event cluster","high","summary_only","reports/04_march2026_beta_phase.md","Reduces derived-output and duplicate amplification."
EVID-006,multi_device,multiple,usageClientId_related_logs,,usageclientid_transition,"Repeated usageClientId switching/discontinuity observed across logs/devices","Account / usage-state transition candidate","medium_high","summary_only","reports/02_usageclientid_shift.md","Requires dedicated report section."
EVID-007,multi_device,multiple,ScreenTime_GameCenter_ContentPrivacy_logs,,restriction_layer,"ScreenTime / Game Center / Content & Privacy / ManagedSettings / FamilyControls signals without visible MDM/supervised/userIsManaged indicators","Restriction-layer inconsistency candidate","high","summary_only","reports/03_screentime_gamecenter_restrictions.md","Do not claim official MDM enrollment."
EVID-008,comparative,multiple,APT32_APT42_LIMINAL_TTP_comparison,,ttp_comparison,"Observed structure compared against public APT32/APT42/LIMINAL PANDA TTPs","TTP/doctrine comparison only, not attribution","medium_high","public_summary","reports/06_ttp_comparison_apt32_apt42_liminal.md","APT names are used only as public comparison points."
